Name,Price,Image
Royal Canin Labrador Retriever Comida húmeda 140 Grs. - 10 Unidades.,13.17,https://www.petsonic.com/24017-large_default/royal-canin-labrador-retriever-comida-humeda.jpg
Royal Canin Maxi Puppy (Sobre) comida húmeda - 10 unidades de 150 gr,10.16,https://www.petsonic.com/23406-large_default/comida-lata-para-perros-royal-canin-maxi-puppy-sobre.jpg
Royal Canin Veterinary Diets Renal 410gr Húmedo - 12 Unidades.,30.44,https://www.petsonic.com/8142-large_default/comida-lata-para-perros-royal-canin-veterinary-diets-renal-410gr-humedo.jpg
Farmina ND Dog Quinoa Skin Coat Codorniz comida húmeda para perros 6x285grs - 6x285Grs,14.68,https://www.petsonic.com/26014-large_default/farmina-nd-dog-quinoa-skin-coat-codorniz-comida-humeda-para-perros-6x285grs.jpg
Taste of the Wild Wetlands comida húmeda para perros (Latas) 12x390Grs - 12 unidades 390grs,23.96,https://www.petsonic.com/25108-large_default/taste-of-the-wild-wetlands-comida-humeda-para-perros-latas.jpg
Royal Canin Canine Renal Liquido para perro - 3x200,16.68,https://www.petsonic.com/20575-large_default/canine-renal-liquido.jpg
Carnilove Adulto Venado y Reno latas de comida humeda para perro Venison & Reindeer - 6 Unidades de 400 gr,15.59,https://www.petsonic.com/12485-large_default/comida-lata-para-perros-carnilove-adulto-venado-reno-humedo.jpg
Taste Of The Wild Sierra Mountain con Cordero 390gr - 12 unidades de 400gr,23.96,https://www.petsonic.com/25384-large_default/sierra-mountain-con-cordero-390gr.jpg
Royal Canin Veterinary Diets Hypoallergenic 410 gr Húmedo - 12 Unidades.,30.80,https://www.petsonic.com/24060-large_default/comida-lata-para-perros-royal-canin-veterinary-diets-hypoallergenic-410-gr-humedo.jpg
Taste of the Wild Pacific Stream comida húmeda para perros (Latas) - 12 unidades 390grs,23.96,https://www.petsonic.com/25107-large_default/taste-of-the-wild-pacific-stream-comida-humeda-para-perros-latas.jpg
Royal Canin Mini Puppy (Sobre) comida húmeda - 12 unidades 85 gr,10.98,https://www.petsonic.com/23427-large_default/comida-lata-para-perros-royal-canin-mini-puppy-sobre.jpg
Carnilove Adult Salmón y Pavo latas de comida humeda para perro Salmon & Turkey - 6 Unidades de 400 gr,17.00,https://www.petsonic.com/20637-large_default/comida-lata-para-perros-carnilove-adult-salmon-pavo-humedo.jpg
Brit pate meat puppy comida en lata perros - 6 x 400 Gr,14.85,https://www.petsonic.com/28683-large_default/brit-pate-meat-puppy-comida-en-lata-perros.jpg
Nature's Variety Original paté Mini Pollo Comida húmeda perros - Pack 8x150 Grs,11.50,https://www.petsonic.com/26507-large_default/nature-s-variety-original-pate-mini-pollo-comida-humeda-perros.jpg
Royal Canin Babydog milk Leche para cachorros - 400 Gr.,15.16,https://www.petsonic.com/2067-large_default/comida-lata-para-perros-royal-canin-leche-para-cachorros.jpg
Royal Canin Babydog milk Leche para cachorros - 2 Kg.,39.96,https://www.petsonic.com/2067-large_default/comida-lata-para-perros-royal-canin-leche-para-cachorros.jpg
Arquivet Natural Wet PESCADO y Verduras 500 g Snack para perros - 12 unidades,20.72,https://www.petsonic.com/27250-large_default/arquivet-natural-wet-pescado-y-verduras-500-g-snack-para-perros.jpg
Comida húmeda Arquivet Wet DOG FOOD 400g JUNIOR Pollo - 6 unidades,15.16,https://www.petsonic.com/27354-large_default/comida-humeda-arquivet-wet-dog-food-400g-junior-pollo.jpg
Nature's Variety Original paté Medium/Maxi Buey Comida húmeda perros - 6x300Grs,17.95,https://www.petsonic.com/26504-large_default/nature-s-variety-original-pate-medium-maxi-buey-comida-humeda-perros.jpg
Comida humeda para perros adultos Specific CXW 300 grs - 6 Unidades.,13.68,https://www.petsonic.com/24762-large_default/comida-humeda-para-perros-adultos-specific-cxw-300-grs.jpg
Comida humeda para perros mayores Specific CGW 300 grs - 6 Unidades.,13.60,https://www.petsonic.com/24754-large_default/comida-humeda-para-perros-mayores-specific-cgw-300-grs.jpg
Brit sausage con pollo y venado comida en lata perros - 12 x 800 Gr,31.97,https://www.petsonic.com/28687-large_default/brit-sausage-con-pollo-y-venado-comida-en-lata-perros.jpg
Brit care mini puppy filetes cordero en salsa comida en lata gatos - 24 x 85 Gr,28.08,https://www.petsonic.com/28647-large_default/brit-care-mini-puppy-filetes-cordero-en-salsa-comida-en-lata-gatos.jpg
Carnilove Adulto Pato y Faisan latas de comida humeda para perro Duck & Pheasant - 6 Unidades de 400 gr,15.59,https://www.petsonic.com/12487-large_default/comida-lata-para-perros-carnilove-adulto-pato-guisantes-humedo.jpg
Farmina ND Dog Pumpkin Jabalí comida húmeda para perros 6x285grs - 6x285Grs,14.68,https://www.petsonic.com/25990-large_default/farmina-nd-dog-pumpkin-jabali-comida-humeda-para-perros-6x285grs.jpg
Comida humeda para cachorros Specific CPW 300 grs - 6 Unidades.,18.63,https://www.petsonic.com/24752-large_default/comida-humeda-para-cachorros-specific-cpw-300-grs.jpg
Farmina ND Dog Prime Cordero comida húmeda para perros 6x285grs - 6x285Grs,14.68,https://www.petsonic.com/25979-large_default/farmina-nd-dog-prime-cordero-comida-humeda-para-perros-6x285grs.jpg
Brit pate meat pavo comida en lata perros - 6 x 400 Gr,14.85,https://www.petsonic.com/28681-large_default/brit-pate-meat-pavo-comida-en-lata-perros.jpg
Brit mono protein cordero comida en lata perros - 6 x 400 Gr,15.93,https://www.petsonic.com/28677-large_default/brit-mono-protein-cordero-comida-en-lata-perros.jpg
Royal Canin Veterinary Diets Sensitivity Control Pato 420 gr.Húmedo - 12 Unidades.,29.57,https://www.petsonic.com/24049-large_default/comida-lata-para-perros-royal-canin-veterinary-diets-sensitivity-control-pato-420-gr-humedo.jpg
Royal Canin Veterinary Diets Gastro Intestinal 400g Húmedo - 12 Unidades.,27.72,https://www.petsonic.com/23732-large_default/comida-lata-para-perros-royal-canin-veterinary-diets-gastro-intestinal-400g-humedo.jpg
Royal Canin Veterinary Diets Hepatic 420 gr Húmedo - 12 unidades de 400gr,32.85,https://www.petsonic.com/24061-large_default/comida-lata-para-perros-royal-canin-veterinary-diets-hepatic-420-gr-humedo.jpg
Royal Canin Veterinary Diets Recovery 195 gr Húmedo - 12 Unidades.,25.34,https://www.petsonic.com/24067-large_default/comida-lata-para-gatos-royal-canin-veterinary-diets-recovery-195-gr-humedo.jpg
Royal Canin Yorkshire Pouch 85 gr. Comida hùmeda raza - 12 unidades 85 gr,11.36,https://www.petsonic.com/23563-large_default/comida-lata-para-perros-royal-canin-yorkshire-pouch-85-gr.jpg
Royal Canin Veterinary Diets Satiety Support Weight Management 410 gr. Húmedo - 12 Unidades.,25.34,https://www.petsonic.com/24050-large_default/comida-lata-para-perros-royal-canin-veterinary-diets-satiety-support-weight-management-410-gr-humedo.jpg
Arquivet Natural Wet POLLO y Verduras 500 g Snack para perros - 12 unidades,20.72,https://www.petsonic.com/27252-large_default/arquivet-natural-wet-pollo-y-verduras-500-g-snack-para-perros.jpg
Royal Canin Veterinary Diets Cardiac 410 gr. Húmedo - 12 Unidades.,27.39,https://www.petsonic.com/28722-large_default/comida-lata-para-perros-royal-canin-veterinary-diets-cardiac-410-gr-humedo.jpg
Ownat Wetline comida húmeda para perros chicken & carrots - 6x400gr,15.99,https://www.petsonic.com/26209-large_default/ownat-wetline-comida-humeda-para-perros-chicken-carrots.jpg
Farmina ND Dog Ocean Pumpkin Puppy Bacalao comida húmeda para cachorros 6x285grs - 6x285Grs,24.38,https://www.petsonic.com/26002-large_default/farmina-nd-dog-ocean-pumpkin-puppy-bacalao-comida-humeda-para-cachorros-6x285grs.jpg
Royal Canin vet. Canine Urinary S/O Ageing +7 - 12 unidades 85 gr,11.84,https://www.petsonic.com/24000-large_default/royal-canin-vet-canine-urinary-so-ageing-7.jpg
Arquivet Natural Wet CONEJO y Verduras 500 g Snack para perros - 12 unidades,20.72,https://www.petsonic.com/27248-large_default/arquivet-natural-wet-conejo-y-verduras-500-g-snack-para-perros.jpg
Brit pate meat cordero comida en lata perros - 6 x 400 Gr,14.85,https://www.petsonic.com/28680-large_default/brit-pate-meat-cordero-comida-en-lata-perros.jpg
Royal Canin Veterinary Diets Diabetic Low Carbohydrate 410gr.Húmedo - 12 Unidades.,27.67,https://www.petsonic.com/20599-large_default/comida-lata-para-perros-royal-canin-veterinary-diets-diabetic-low-carbohydrate-410gr-humedo.jpg
Brit fresh pescado calabaza comida en lata perros - 6 x 400 Gr,15.93,https://www.petsonic.com/28659-large_default/brit-fresh-pescado-calabaza-comida-en-lata-perros.jpg
Brit mono protein atun y con patata comida en lata perros - 6 x 400 Gr,15.93,https://www.petsonic.com/28676-large_default/brit-mono-protein-atun-y-con-patata-comida-en-lata-perros.jpg
Farmina ND Dog Pumpkin Pollo comida húmeda para perros 6x285grs - 6x285Grs,14.68,https://www.petsonic.com/25997-large_default/farmina-nd-dog-pumpkin-pollo-comida-humeda-para-perros-6x285grs.jpg
Royal Canin dermacomfort pouch. Comida húmeda para perro - 12 unidades 85 gr,13.16,https://www.petsonic.com/24010-large_default/royal-canin-dermacomfort-pouch-comida-humeda-para-perro.jpg
Comida húmeda Arquivet Wet DOG FOOD 400g ADULT Salmon y Pavo - 6 unidades,15.39,https://www.petsonic.com/27352-large_default/comida-humeda-arquivet-wet-dog-food-400g-adult-salmon-y-pavo.jpg
Calibra dog puppy junior comida en lata pollo arroz - 6x400 Gr,12.94,https://www.petsonic.com/28356-large_default/calibra-dog-puppy-junior-comida-en-lata-pollo-arroz.jpg
Farmina ND Dog Pumpkin Cordero comida húmeda para perros 6x285grs - 6x285Grs,14.68,https://www.petsonic.com/25989-large_default/farmina-nd-dog-pumpkin-cordero-comida-humeda-para-perros-6x285grs.jpg
Royal Canin Veterinary Diets Urinary S/O 410gr Húmedo - 12 Unidades.,27.39,https://www.petsonic.com/20400-large_default/comida-lata-para-perros-royal-canin-veterinary-diets-urinary-s-410gr-humedo.jpg
Farmina ND Dog Ocean Trucha y Salmón comida húmeda para perros 6x285grs - 6x285Grs,14.68,https://www.petsonic.com/25978-large_default/farmina-nd-dog-ocean-trucha-y-salmon-comida-humeda-para-perros-6x285grs.jpg
Brit mono protein ternera comida en lata perros - 6 x 400 Gr,15.93,https://www.petsonic.com/28679-large_default/brit-mono-protein-ternera-comida-en-lata-perros.jpg
Nature's Variety Original paté Mini Pavo Comida húmeda perros - Pack 8x150 Grs,11.50,https://www.petsonic.com/26508-large_default/nature-s-variety-original-pate-mini-pavo-comida-humeda-perros.jpg
Brit care mini filetes cordero en salsa comida en lata gatos - 24 x 85 Gr,28.08,https://www.petsonic.com/28642-large_default/brit-care-mini-filetes-cordero-en-salsa-comida-en-lata-gatos.jpg
Nature's Variety Original paté Medium/Maxi Pavo Comida húmeda perros - 6x300Grs,17.95,https://www.petsonic.com/26517-large_default/nature-s-variety-original-pate-medium-maxi-pavo-comida-humeda-perros.jpg
Brit fresh ternera calabaza comida en lata perros - 6 x 400 Gr,15.93,https://www.petsonic.com/28663-large_default/brit-fresh-ternera-calabaza-comida-en-lata-perros.jpg
Brit fresh ternera mijo comida en lata perros - 6 x 400 Gr,15.93,https://www.petsonic.com/28664-large_default/brit-fresh-ternera-mijo-comida-en-lata-perros.jpg
Brit fresh pollo con patata comida en lata perros - 6 x 400 Gr,15.93,https://www.petsonic.com/28660-large_default/brit-fresh-pollo-con-patata-comida-en-lata-perros.jpg
Ownat Wetline comida húmeda para perros turkey & pumpkin - 6x400gr,15.99,https://www.petsonic.com/26208-large_default/ownat-wetline-comida-humeda-para-perros-trukey-pumpkin.jpg
Royal Canin Medium Adult (Sobre) comida húmeda - 10 unidades de 150 gr,10.73,https://www.petsonic.com/23415-large_default/comida-lata-para-perros-royal-canin-medium-adult-sobre.jpg
Brit mono protein pavo y con patata comida en lata perros - 6 x 400 Gr,15.93,https://www.petsonic.com/28678-large_default/brit-mono-protein-pavo-y-con-patata-comida-en-lata-perros.jpg
Calibra dog comida en lata sensitive cordero y aceite salmon - 6x400 Gr,12.94,https://www.petsonic.com/28357-large_default/calibra-dog-comida-en-lata-sensitive-cordero-y-aceite-salmon.jpg
Farmina ND Dog Prime Puppy Pollo comida húmeda para cachorros 6x285grs - 6x285Grs,14.68,https://www.petsonic.com/26006-large_default/farmina-nd-dog-prime-puppy-pollo-comida-humeda-para-cachorros-6x285grs.jpg
Hills Prescription Diet PD Canine i/d. 370 gr. Húmedo. - 12 Unidades.,37.85,https://www.petsonic.com/17405-large_default/comida-lata-para-perros-hill-s-prescription-diet-pd-canine-d-370-gr-humedo.jpg
Brit pate meat pollo comida en lata perros - 6 x 400 Gr,14.85,https://www.petsonic.com/28682-large_default/brit-pate-meat-pollo-comida-en-lata-perros.jpg
Brit sausage con ternera y pescado sport formula comida en lata perros - 12 x 800 Gr,31.97,https://www.petsonic.com/28688-large_default/brit-sausage-con-ternera-y-pescado-sport-formula-comida-en-lata-perros.jpg
Hills SP Puppy con Pollo (Lata) - 12 unidades de 370 gr,33.89,https://www.petsonic.com/24076-large_default/comida-lata-para-perros-hills-sp-puppy-pollo-lata.jpg
Comida húmeda Arquivet Wet DOG FOOD 400g SENIOR & LIGHT Pollo - 6 unidades,14.85,https://www.petsonic.com/27355-large_default/comida-humeda-arquivet-wet-dog-food-400g-senior-light-pollo.jpg
Farmina ND Dog Quinoa Skin Coat Pato comida húmeda para perros 6x285grs - 6x285Grs,14.68,https://www.petsonic.com/26016-large_default/farmina-nd-dog-quinoa-skin-coat-pato-comida-humeda-para-perros-6x285grs.jpg
Arquivet Natural Wet TERNERA y Verduras 500 g Snack para perros - 12 unidades,20.72,https://www.petsonic.com/27253-large_default/arquivet-natural-wet-ternera-y-verduras-500-g-snack-para-perros.jpg
Arquivet Natural Wet PESCADO y Verduras 500 g Snack para perros - 12 unidades,20.72,https://www.petsonic.com/27250-large_default/arquivet-natural-wet-pescado-y-verduras-500-g-snack-para-perros.jpg
Hills Prescription Diet Lata PD Canine/Feline a/d. 156 gr. Húmedo. - 24 Unidades.,57.42,https://www.petsonic.com/14999-large_default/comida-lata-para-gatos-hill-s-prescription-diet-pd-canine-feline-d-156-gr-humedo.jpg
Nature's Variety Original paté Mini Buey Comida húmeda perros - Pack 8x150 Grs,11.50,https://www.petsonic.com/26506-large_default/nature-s-variety-original-pate-mini-buey-comida-humeda-perros.jpg
Purina Veterinary Diets OM Lata 400 gr para Perro - 12 Unidades.,33.53,https://www.petsonic.com/8734-large_default/comida-lata-para-perros-purina-veterinary-diets-om-lata-400-gr.jpg
Purina Veterinary Diets NF lata 400gr para Perro - 12 unidades de 400gr,33.53,https://www.petsonic.com/8736-large_default/comida-lata-para-perros-purina-veterinary-diets-nf-lata-400gr.jpg
Royal Canin Chihuahua Pouch 85 gr. Comida húmeda raza. - 12 unidades 85 gr,11.17,https://www.petsonic.com/23198-large_default/comida-lata-para-perros-royal-canin-chihuahua-pouch-85-gr.jpg
Calibra dog adult comida en lata pavo con corazon de pollo - 6x400 Gr,12.94,https://www.petsonic.com/28317-large_default/calibra-dog-adult-comida-en-lata-pavo-con-corazon-de-pollo.jpg
Brit care mini filetes pollo y atun en salsa comida en lata gatos - 24 x 85 Gr,28.08,https://www.petsonic.com/28643-large_default/brit-care-mini-filetes-pollo-y-atun-en-salsa-comida-en-lata-gatos.jpg
Royal Canin Starter Mousse Gestación/Lactancia - 12 unidades de 195 gr,24.68,https://www.petsonic.com/23743-large_default/comida-lata-para-perros-royal-canin-starter-mousse-gestacion-lactancia.jpg
Ownat Wetline comida húmeda para perros lamb & potatoes - 6x400gr,15.99,https://www.petsonic.com/26207-large_default/ownat-wetline-comida-humeda-para-perros-lamb-potatoes.jpg
Royal Canin Mini Adult (Sobre) comida húmeda - 12 unidades 85 gr,11.84,https://www.petsonic.com/23437-large_default/comida-lata-para-perros-royal-canin-mini-adult-sobre.jpg
Brit pate meat ternera comida en lata perros - 6 x 400 Gr,14.85,https://www.petsonic.com/28685-large_default/brit-pate-meat-ternera-comida-en-lata-perros.jpg
Comida húmeda Arquivet Wet DOG FOOD 400g ADULT Pavo y Ternera - 6 unidades,15.39,https://www.petsonic.com/27351-large_default/comida-humeda-arquivet-wet-dog-food-400g-adult-pavo-y-ternera.jpg
Comida húmeda Arquivet Wet DOG FOOD 400g ADULT Cordero y Pollo - 6 unidades,15.39,https://www.petsonic.com/27350-large_default/comida-humeda-arquivet-wet-dog-food-400g-adult-cordero-y-pollo.jpg
Farmina ND Dog Prime Pollo comida húmeda para perros 6x285grs - 6x285Grs,14.68,https://www.petsonic.com/25988-large_default/farmina-nd-dog-prime-pollo-comida-humeda-para-perros-6x285grs.jpg
Brit care mini filetes salmon y arenques en salsa comida en lata gatos - 24 x 85 Gr,28.08,https://www.petsonic.com/28644-large_default/brit-care-mini-filetes-salmon-y-arenques-en-salsa-comida-en-lata-gatos.jpg
Hills Prescription Diet PD Canine Metabolic 370 gr. Húmedo. - 12 Unidades.,37.85,https://www.petsonic.com/17353-large_default/comida-lata-para-perros-hill-s-prescription-diet-pd-canine-metabolic-370-gr-humedo.jpg
Brit fresh pato mijo comida en lata perros - 6 x 400 Gr,15.93,https://www.petsonic.com/28657-large_default/brit-fresh-pato-mijo-comida-en-lata-perros.jpg
Farmina ND Dog Prime Jabalí comida húmeda para perros 6x285grs - 6x285Grs,14.68,https://www.petsonic.com/25980-large_default/farmina-nd-dog-prime-jabali-comida-humeda-para-perros-6x285grs.jpg
Farmina ND Dog Quinoa digestion comida húmeda para perros 12x80grs - 6x285Grs,14.68,https://www.petsonic.com/26011-large_default/farmina-nd-dog-quinoa-digestion-comida-humeda-para-perros-12x80grs.jpg
Calibra dog adult comida en lata venado arandanos - 6x400 Gr,12.94,https://www.petsonic.com/28319-large_default/calibra-dog-adult-comida-en-lata-venado-arandanos.jpg
Brit pate meat salmon comida en lata perros - 6 x 400 Gr,14.85,https://www.petsonic.com/28684-large_default/brit-pate-meat-salmon-comida-en-lata-perros.jpg
Purina Veterinary Diets EN lata 400gr para Perro - 12 unidades de 400gr,33.53,https://www.petsonic.com/8873-large_default/comida-lata-para-perros-purina-veterinary-diets-lata-400gr.jpg
Farmina ND Dog Quinoa Skin Coat Arenque comida húmeda para perros 6x285grs - 6x285Grs,14.68,https://www.petsonic.com/26012-large_default/farmina-nd-dog-quinoa-skin-coat-arenque-comida-humeda-para-perros-6x285grs.jpg
Ownat Wetline comida húmeda para perros beef & salmon - 6x400gr,15.99,https://www.petsonic.com/26206-large_default/ownat-wetline-comida-humeda-para-perros-beef-salmon.jpg
Farmina ND Dog Pumpkin Puppy Cordero comida húmeda para cachorros 6x285grs - 6x285Grs,14.68,https://www.petsonic.com/26007-large_default/farmina-nd-dog-pumpkin-puppy-cordero-comida-humeda-para-cachorros-6x285grs.jpg
Calibra dog adult comida en lata ternera zanahorias - 6x400 Gr,12.94,https://www.petsonic.com/28318-large_default/calibra-dog-adult-comida-en-lata-ternera-zanahorias.jpg
Arquivet Natural Wet PAVO y Verduras 500 g Snack para perros - 12 unidades,20.72,https://www.petsonic.com/27249-large_default/arquivet-natural-wet-pavo-y-verduras-500-g-snack-para-perros.jpg
Farmina ND Dog Quinoa Skin Coat Venado comida húmeda para perros 6x285grs - 6x285Grs,14.68,https://www.petsonic.com/26019-large_default/farmina-nd-dog-quinoa-skin-coat-venado-comida-humeda-para-perros-6x285grs.jpg
Comida húmeda Arquivet Wet DOG FOOD 400g ADULT Ternera y Pollo - 6 unidades,15.16,https://www.petsonic.com/27353-large_default/comida-humeda-arquivet-wet-dog-food-400g-adult-ternera-y-pollo.jpg
Brit sausage con pollo y cordero comida en lata perros - 12 x 800 Gr,31.97,https://www.petsonic.com/28686-large_default/brit-sausage-con-pollo-y-cordero-comida-en-lata-perros.jpg
Brit fresh pavo guisantes comida en lata perros - 6 x 400 Gr,15.93,https://www.petsonic.com/28658-large_default/brit-fresh-pavo-guisantes-comida-en-lata-perros.jpg
