Name,Price,Image
Puerta Prima Door Ferplast - Recambio,1.50,https://www.petsonic.com/21474-large_default/puerta-prima-door-ferplast.jpg
Magic Blue Recambio gatos Catit - 6 unidades,15.40,https://www.petsonic.com/26663-large_default/magic-blue-recambio-gatos-catit.jpg
Arenero para gatos Nova - 56 x 40 x 39 cm,26.22,https://www.petsonic.com/27198-large_default/arenero-para-gatos-nova.jpg
Arenero para gatos Netta - 54 x 39 x 40 cm,33.21,https://www.petsonic.com/27197-large_default/arenero-para-gatos-netta.jpg
Arenero para gatos Netta abierto - 54 x 39 x 29 cm,18.22,https://www.petsonic.com/27196-large_default/arenero-para-gatos-netta-abierto.jpg
Arenero para gatos Kroxi - 52 x 39 x 39 cm,21.51,https://www.petsonic.com/27195-large_default/arenero-para-gatos-kroxi.jpg
Arenero para gatos Komoda - 54 x 39 x 40 cm,25.62,https://www.petsonic.com/27194-large_default/arenero-para-gatos-komoda.jpg
Arenero para gatos esquinero Corner - 54x40x55 cm,32.88,https://www.petsonic.com/27193-large_default/arenero-para-gatos-esquinero-corner.jpg
