Name,Price,Image
Cunipic VetLine dieta para conejos Intestinal - 1.4 Kg.,13.46,https://www.petsonic.com/21482-large_default/cunipic-vetline-dieta-para-conejos-intestinal.jpg
Cunipic VetLine dieta para conejos Renal - 1.4 Kg.,13.46,https://www.petsonic.com/28568-large_default/cunipic-vetline-dieta-para-conejos-renal.jpg
Cunipic VetLine dieta para conejos Dental - 1.4 Kg.,13.46,https://www.petsonic.com/28566-large_default/cunipic-vetline-dieta-para-conejos-dental.jpg
Cunipic VetLine dieta para cobayas intestinal - 1.4 Kg.,12.75,https://www.petsonic.com/28562-large_default/cunipic-vetline-dieta-para-cobayas-intestinal.jpg
Cunipic conejo adulto comida para conejo - 3 Kg.,8.24,https://www.petsonic.com/28554-large_default/cunipic-conejo-adulto-comida-para-conejo.jpg
Cunipic conejo adulto comida para conejo - 5 Kg ,11.16,https://www.petsonic.com/28554-large_default/cunipic-conejo-adulto-comida-para-conejo.jpg
Cunipic Alpha Pro para cobayas - 1.75 kg,12.67,https://www.petsonic.com/21495-large_default/cunipic-alpha-pro-para-cobayas.jpg
Cunipic Alpha Pro para chinchillas - 1.75 kg,13.39,https://www.petsonic.com/28550-large_default/cunipic-alpha-pro-para-chinchillas.jpg
Naturaliss Grain Free comida para conejo adulto - 1.81 Kg,7.54,https://www.petsonic.com/28586-large_default/naturaliss-grain-free-comida-para-conejo-adulto.jpg
Naturaliss Grain Free comida para cobaya - 1.81 Kg,7.54,https://www.petsonic.com/28584-large_default/naturaliss-grain-free-comida-para-cobaya.jpg
Cunipic Alpha Pro para conejos adultos - 1.75 kg,12.59,https://www.petsonic.com/28548-large_default/cunipic-alpha-pro-para-conejos-adultos.jpg
